{"schema_version": "0.1", "version": "0.1.0", "skill_id": "memory.append", "scope": "manifest_memory", "entrypoint": "memory.append", "capabilities": ["memory.write"], "verification": {"mode": "advisory", "hook": "verify.default"}, "rollback": {"strategy": "snapshot_restore", "backup_root": "/Users/dragonpd/Sophia/.sophia/backups"}, "limits": {"timeout_ms": 30000, "max_retries": 0}}
